{"$schema": "./schema.json", "instanceId": "blaze.defaults", "theme": {}, "global": {"speed": 1, "delayOffset": 0, "easing": "ease-out-cubic"}, "elements": [], "extras": {"height": 0.97, "distortion": 0.6, "distortionScale": 0.5, "speed": 1, "sparks": 0.5, "sparkDensity": 1.5, "sparkSize": 1, "layers": 4, "smoke": 0.5, "glow": 1.5, "sparkColor": [1, 0.4, 0.05], "smokeColor": [1, 0.43, 0.1], "fadeInFrames": 0, "fadeOutFrames": 0}}